{
  "id":"issue.downstream-ui-regressions",
  "type":"issue",
  "status":"current",
  "authority":"secondary",
  "updated_at":"2026-08-26T00:00:56+02:00",
  "summary":"Two still-valid downstream UI regressions were isolated from stale recovery work and prepared on a fresh branch without reintroducing the superseded media-row geometry change.",
  "facts":[
    {"key":"home_top_bar_regression","value":"Current main lacks the previously established Settings and own-Profile Home top-bar actions while retaining Notifications.","confidence":"verified","evidence":["feature/home/src/main/java/com/axiel7/anihyou/feature/home/HomeView.kt","https://github.com/madebycli/Kiyori/pull/13"]},
    {"key":"discover_shortcut_regression","value":"Current main uses a single horizontal shortcut row; the prepared fix restores responsive 2/3/4-column shortcuts without changing navigation targets.","confidence":"verified","evidence":["feature/explore/src/main/java/com/axiel7/anihyou/feature/explore/discover/DiscoverView.kt","https://github.com/madebycli/Kiyori/pull/13"]},
    {"key":"media_row_recovery_change","value":"superseded","confidence":"verified","evidence":["core/ui/src/main/java/com/axiel7/anihyou/core/ui/composables/media/MediaItemHorizontal.kt","https://github.com/madebycli/Kiyori/commit/ff7c418cdc0517a3142fbba4827ead311a5e2ca9"]},
    {"key":"prepared_fix","value":"Draft PR #13 on fix/downstream-ui-regressions; unmerged and subject to CI plus physical UI smoke test.","confidence":"verified","evidence":["https://github.com/madebycli/Kiyori/pull/13"]}
  ],
  "constraints":["Do not reapply the old 12dp/top-aligned media-row recovery variant; preserve the later stable symmetric supporting-content fix.","Do not merge the prepared product fix to main without the repository-safety authorization and required verification.","Keep Home notification behavior and existing Discover navigation destinations unchanged."],
  "relations":{"protected_by":["contract.product-invariants"],"governed_by":["contract.repository-safety"],"informed_by":["policy.upstream-sync"]},
  "evidence":[{"kind":"pr","ref":"https://github.com/madebycli/Kiyori/pull/13","observed_at":"2026-08-26T00:00:56+02:00"},{"kind":"commit","ref":"https://github.com/madebycli/Kiyori/commit/589db886a9a6e8b7bd985617413ce1e47c4ba6ad","observed_at":"2026-08-26T00:00:56+02:00"},{"kind":"commit","ref":"https://github.com/madebycli/Kiyori/commit/77df4bec747481b2178e3c47f872831bc6af4f83","observed_at":"2026-08-26T00:00:56+02:00"}]
}
