{
  "id": "issue.media-details-airing-freshness",
  "type": "issue",
  "status": "current",
  "authority": "secondary",
  "updated_at": "2026-08-26T16:38:00+02:00",
  "summary": "Media details freshness is now hardened on main with NetworkFirst plus Apollo normalized-cache watch(), so newly opened details prefer current network data and retained detail collectors can receive fresher cache updates. The original episode 9/10 device reproduction is still pending, so the issue remains current rather than resolved.",
  "facts": [
    {
      "key": "observed_reproduction",
      "value": "The same anime was reported with stale episode/next-airing data through a normal entry path and correct data when opened through Calendar. Calendar does not pass episode state into MediaDetails, it navigates with the same media ID route.",
      "confidence": "declared",
      "evidence": [
        "https://github.com/madebycli/Kiyori/pull/16",
        "core/ui/src/main/java/com/axiel7/anihyou/core/ui/common/navigation/NavActionManager.kt"
      ]
    },
    {
      "key": "route_payload",
      "value": "NavActionManager.toMediaDetails(id) creates only Route.MediaDetails(id). Navigator appends non-top-level routes to the currently selected top-level back stack.",
      "confidence": "verified",
      "evidence": [
        "core/ui/src/main/java/com/axiel7/anihyou/core/ui/common/navigation/NavActionManager.kt",
        "core/ui/src/main/java/com/axiel7/anihyou/core/ui/common/navigation/Navigator.kt"
      ]
    },
    {
      "key": "retained_top_level_state",
      "value": "NavigationState creates a separate NavBackStack for every top-level route, decorates every stack with a ViewModelStore NavEntry decorator, and explicitly retains state even when a top-level route is not currently in use.",
      "confidence": "verified",
      "evidence": [
        "core/ui/src/main/java/com/axiel7/anihyou/core/ui/common/navigation/NavigationState.kt"
      ]
    },
    {
      "key": "media_details_viewmodel_loading",
      "value": "MediaDetailsViewModel starts getMediaDetails() from init. MediaDetailsView obtains the ViewModel from the NavEntry-scoped Koin ViewModelStore and there is no general visibility/resume network reload path for the details query.",
      "confidence": "verified",
      "evidence": [
        "feature/mediadetails/src/main/java/com/axiel7/anihyou/feature/mediadetails/MediaDetailsViewModel.kt",
        "feature/mediadetails/src/main/java/com/axiel7/anihyou/feature/mediadetails/MediaDetailsView.kt"
      ]
    },
    {
      "key": "implemented_freshness_fix",
      "value": "Merged PR #20 changes MediaRepository.getMediaDetails() to FetchPolicy.NetworkFirst plus Apollo normalized-cache watch(). New detail loads prefer current AniList data with cache fallback, while retained collectors can receive published normalized-cache updates without polling or navigation recreation.",
      "confidence": "verified",
      "evidence": [
        "core/domain/src/main/java/com/axiel7/anihyou/core/domain/repository/MediaRepository.kt",
        "https://github.com/madebycli/Kiyori/pull/20",
        "https://github.com/madebycli/Kiyori/commit/8a2289ca75a4a66b6ae2e97303ee2d3f2b8be1e8"
      ]
    },
    {
      "key": "root_cause_status",
      "value": "Two freshness mechanisms are proven to have existed: a detail query path without an explicit freshness override and retained per-top-level MediaDetails ViewModel state. Both are now hardened by the merged NetworkFirst plus cache-watch implementation, but the physical reproduction needed to prove the original reported symptom is fixed remains missing.",
      "confidence": "supported",
      "evidence": [
        "https://github.com/madebycli/Kiyori/pull/20",
        "core/ui/src/main/java/com/axiel7/anihyou/core/ui/common/navigation/NavigationState.kt",
        "feature/mediadetails/src/main/java/com/axiel7/anihyou/feature/mediadetails/MediaDetailsViewModel.kt"
      ]
    },
    {
      "key": "pr20_ci",
      "value": "PR #20 combined head fa52940514f4829221fe31aca3f75e3e5310dc44 passed Android CI run 32979821681 and Temporary Performance APK run 32979821731. Artifact 9611240387 belongs to that exact head. The PR was squash-merged to main as 8a2289ca75a4a66b6ae2e97303ee2d3f2b8be1e8.",
      "confidence": "verified",
      "evidence": [
        "GitHub Actions run 32979821681",
        "GitHub Actions run 32979821731",
        "GitHub Actions artifact 9611240387",
        "https://github.com/madebycli/Kiyori/pull/20",
        "https://github.com/madebycli/Kiyori/commit/8a2289ca75a4a66b6ae2e97303ee2d3f2b8be1e8"
      ]
    },
    {
      "key": "superseded_prs",
      "value": "Ready PR #17 was closed as superseded by merged PR #20. Draft PR #16 received the same superseded provenance comment; its close mutation was blocked by the connector, so no false closed-state claim is made.",
      "confidence": "verified",
      "evidence": [
        "https://github.com/madebycli/Kiyori/pull/16",
        "https://github.com/madebycli/Kiyori/pull/17",
        "https://github.com/madebycli/Kiyori/pull/20"
      ]
    }
  ],
  "constraints": [
    "Do not describe retained ViewModel state as the sole proven root cause until a reproducible test or physical run distinguishes it from the former Apollo freshness path.",
    "Do not claim the original episode 9/10 reproduction is physically fixed until the real-device comparison is performed.",
    "Do not disable Apollo caching globally.",
    "Do not delete or collapse the separate top-level back stacks merely to force MediaDetails recreation.",
    "Keep this issue distinct from issue.aniworld-repository-gap: fresher AniList data is not proof of German AniWorld availability."
  ],
  "relations": {
    "protected_by": [
      "contract.product-invariants"
    ],
    "governed_by": [
      "contract.repository-safety"
    ],
    "informed_by": [
      "policy.upstream-sync"
    ],
    "distinct_from": [
      "issue.aniworld-repository-gap"
    ]
  },
  "evidence": [
    {
      "kind": "pr",
      "ref": "https://github.com/madebycli/Kiyori/pull/20",
      "observed_at": "2026-08-26T16:38:00+02:00"
    },
    {
      "kind": "commit",
      "ref": "https://github.com/madebycli/Kiyori/commit/8a2289ca75a4a66b6ae2e97303ee2d3f2b8be1e8",
      "observed_at": "2026-08-26T16:38:00+02:00"
    },
    {
      "kind": "file",
      "ref": "core/domain/src/main/java/com/axiel7/anihyou/core/domain/repository/MediaRepository.kt",
      "observed_at": "2026-08-26T16:38:00+02:00"
    },
    {
      "kind": "file",
      "ref": "core/ui/src/main/java/com/axiel7/anihyou/core/ui/common/navigation/NavigationState.kt",
      "observed_at": "2026-08-26T16:38:00+02:00"
    },
    {
      "kind": "file",
      "ref": "feature/mediadetails/src/main/java/com/axiel7/anihyou/feature/mediadetails/MediaDetailsViewModel.kt",
      "observed_at": "2026-08-26T16:38:00+02:00"
    },
    {
      "kind": "ci",
      "ref": "GitHub Actions run 32979821681",
      "observed_at": "2026-08-26T16:38:00+02:00"
    },
    {
      "kind": "ci",
      "ref": "GitHub Actions run 32979821731 artifact 9611240387",
      "observed_at": "2026-08-26T16:38:00+02:00"
    }
  ]
}
