{
  "id":"history.legacy-inventory","type":"history","status":"historical","authority":"evidence","updated_at":"2026-08-25T23:18:00+02:00",
  "summary":"Complete inventory of the pre-graph docs/ai-context source set observed on main at the migration base. Paths are preserved for selective provenance lookup instead of default recursive ingestion.",
  "facts":[
    {"key":"migration_base_main_sha","value":"ff7c418cdc0517a3142fbba4827ead311a5e2ca9","confidence":"verified","evidence":["https://api.github.com/repos/madebycli/Kiyori/branches/main"]},
    {"key":"legacy_file_count","value":41,"confidence":"verified","evidence":["docs/ai-context tree inventory"]},
    {"key":"legacy_markdown_count","value":34,"confidence":"verified","evidence":["docs/ai-context tree inventory"]},
    {"key":"legacy_image_count","value":5,"confidence":"verified","evidence":["docs/ai-context/evidence tree inventory"]},
    {"key":"legacy_script_count","value":2,"confidence":"verified","evidence":["docs/ai-context/scripts tree inventory"]},
    {"key":"root_markdown","value":["docs/ai-context/ARCHITECTURE_AND_SCOPES.md","docs/ai-context/CURRENT_STATE.md","docs/ai-context/DECISIONS.md","docs/ai-context/IMPLEMENTATION_LOG.md","docs/ai-context/KNOWN_FAILURES.md","docs/ai-context/PERFORMANCE_APK_TEST_PLAN_2026-08-23.md","docs/ai-context/PHASE_PROMPTS.md","docs/ai-context/PLAN2_RELEASE_HANDOFF.md","docs/ai-context/PRODUCT_PLAN.md","docs/ai-context/README.md","docs/ai-context/RECOVERY_CHECKPOINT.md","docs/ai-context/SPEEDRUN_ALL_IN_ONE.md","docs/ai-context/UPSTREAM_BUILD_AUTH.md","docs/ai-context/UPSTREAM_SYNC_2026-08-23_DOWNSTREAM_HANDOFF.md"],"confidence":"verified","evidence":["docs/ai-context root tree"]},
    {"key":"blueprints","value":["docs/ai-context/blueprints/01_navigation_blueprint.md","docs/ai-context/blueprints/02_calendar_blueprint.md","docs/ai-context/blueprints/03_routes_hosts_profile_blueprint.md","docs/ai-context/blueprints/04_settings_editor_alignment_blueprint.md","docs/ai-context/blueprints/05_ci_security_release_blueprint.md"],"confidence":"verified","evidence":["docs/ai-context/blueprints tree"]},
    {"key":"evidence_files","value":["docs/ai-context/evidence/APK_ARTIFACTS.md","docs/ai-context/evidence/SOURCE_BACKUP_AUDIT.md","docs/ai-context/evidence/screenshots/01_add-main-tab-sheet.png","docs/ai-context/evidence/screenshots/02_home-screen.png","docs/ai-context/evidence/screenshots/03_main-navigation-editor.png","docs/ai-context/evidence/screenshots/04_calendar-screen.png","docs/ai-context/evidence/screenshots/05_home-screen-second.png"],"confidence":"verified","evidence":["docs/ai-context/evidence tree"]},
    {"key":"historical_files","value":["docs/ai-context/historical/LEGACY_RECOVERY_CONTEXT.md"],"confidence":"verified","evidence":["docs/ai-context/historical tree"]},
    {"key":"reconstruction_files","value":["docs/ai-context/reconstruction/00_START_HERE.md","docs/ai-context/reconstruction/01_AI_BOOTSTRAP_SPEEDRUN_PROMPT.md","docs/ai-context/reconstruction/02_SPEEDRUN_MASTER_PLAN.md","docs/ai-context/reconstruction/03_RECOVERED_IMPLEMENTATION_MAP.md","docs/ai-context/reconstruction/04_KNOWN_FAILURES_AND_PREVENTION.md","docs/ai-context/reconstruction/05_UI_UX_CONTRACT_AND_IMPROVEMENTS.md","docs/ai-context/reconstruction/06_TEST_ONCE_FINAL_MATRIX.md","docs/ai-context/reconstruction/07_BRANCH_UPSTREAM_AND_COMMIT_STRATEGY.md","docs/ai-context/reconstruction/08_APK_FORENSICS_GUIDE.md","docs/ai-context/reconstruction/09_RELEASE_RECONSTRUCTION.md","docs/ai-context/reconstruction/10_OWNER_FEEDBACK_LEDGER.md","docs/ai-context/reconstruction/11_INTEGRATED_REBUILD_COPY_PROMPT.md"],"confidence":"verified","evidence":["docs/ai-context/reconstruction tree"]},
    {"key":"legacy_scripts","value":["docs/ai-context/scripts/full_validation_matrix.sh","docs/ai-context/scripts/repo_phase_scan.sh"],"confidence":"verified","evidence":["docs/ai-context/scripts tree"]},
    {"key":"overwritten_entrypoint_archive","value":"docs/ai-context/historical/LEGACY_AI_CONTEXT_README_2026-08-25.md","confidence":"verified","evidence":["docs/ai-context/README.md at migration base"]}
  ],
  "constraints":["This inventory describes the source set at migration base and must not be mistaken for current project truth.","Do not bulk-load every inventoried file into an AI context window.","Use the relevant file only when a current graph node or a conflict investigation requires its evidence."],
  "relations":{"cataloged_by":["history.legacy-context"],"superseded_for_current_truth_by":["contract.context-authority"]},
  "evidence":[{"kind":"api","ref":"https://api.github.com/repos/madebycli/Kiyori/contents/docs/ai-context?ref=main","observed_at":"2026-08-25T23:18:00+02:00"}]
}
